Character,Description,Strength,Stealth,Charisma,Cleverness
Lion,"King of the beasts and with the strength of a dozen men, not to mention tawny brawny good looks, the LION is a foridable choice for espionage.",5,1,4,1
Panda,"Big, powerful, and cute, the Panda eat bamboo for many hours each day.",3,0,3,0
Snake,"The serpent, indirect cause of the fall of man and most subtle of the beasts, a sneaky choice for getting in and out quickly.",0,5,3,5
Rabbit,"Fast! Hard to see! Notoriously dumb! The bunny is an intriguing choice, full of mystery.",0,4,2,0
Unicorn,A magical creature with a rainbow tail and the ability to grant wishes and heal all ouchies.,3,-5,5,5
Cat,"Cute, soft, with four little paws and maybe it likes you today, maybe it doesn't, who can say it's a cat.",0,5,2,5
